{
  "schema_version": 1,
  "production": "EqualityExpression",
  "language": "kerml",
  "status": "retired",
  "fingerprint": {
    "spec_clause": "6e340b9cffb37a989ca544e6bb780a2c78901d3fb33738768511a30617afa01d",
    "xtext_rule": "eed16c58d7ac8403256713aba3010a9c47b3e1ad05ea319c492a0cf5a58bf9ac",
    "corpus_instances": "1eb55586ba6da2475bedd8e39e87c0b2bb15a113483f2e2e74b6ae00f8845fee",
    "combined": "8497bca81748af1c2d0bd16777829dfd6af9e818cc3afa7b6cc3b296fec139da"
  },
  "inputs": {
    "spec_clause_ref": "",
    "xtext_file": "KerMLExpressions.xtext",
    "xtext_rule_text": "EqualityExpression returns SysML::Expression :\n\tClassificationExpression ( {SysML::OperatorExpression.operand += current}  \n\t\toperator = EqualityOperator operand += ClassificationExpression )*\n\t\n;",
    "corpus_refs": [
      "vendor/corpus/kerml/src/examples/Address Book Example/AddressBookModel.kerml",
      "vendor/corpus/kerml/src/examples/Association Examples/ProductSelection_N_ary.kerml",
      "vendor/corpus/kerml/src/examples/Association Examples/ProductSelection_OwnedEnds.kerml",
      "vendor/corpus/kerml/src/examples/Association Examples/ProductSelection_UnownedEnds.kerml",
      "vendor/corpus/kerml/src/examples/Behavior Examples/Camera.kerml",
      "vendor/corpus/kerml/src/examples/Behavior Examples/TakePicture.kerml",
      "vendor/corpus/kerml/src/examples/Individuals Examples/JohnIndividualExample.kerml",
      "vendor/corpus/kerml/src/examples/KerML Spec Annex A Examples/A-2-Atoms.kerml",
      "vendor/corpus/kerml/src/examples/KerML Spec Annex A Examples/A-2-ModelingInstances.kerml",
      "vendor/corpus/kerml/src/examples/KerML Spec Annex A Examples/A-3-2-WithoutConnectors.kerml",
      "vendor/corpus/kerml/src/examples/KerML Spec Annex A Examples/A-3-3-OneToOneConnectors.kerml",
      "vendor/corpus/kerml/src/examples/KerML Spec Annex A Examples/A-3-4-OneToUnrestrictedConnectors.kerml",
      "vendor/corpus/kerml/src/examples/KerML Spec Annex A Examples/A-3-5-TimingForStructures.kerml",
      "vendor/corpus/kerml/src/examples/KerML Spec Annex A Examples/A-3-6-Sequences.kerml",
      "vendor/corpus/kerml/src/examples/KerML Spec Annex A Examples/A-3-7-DecisionsAndMerges.kerml",
      "vendor/corpus/kerml/src/examples/KerML Spec Annex A Examples/A-3-8-ChangingFeatureValues.kerml",
      "vendor/corpus/kerml/src/examples/Mass Roll-up Example/MassRollup_1.kerml",
      "vendor/corpus/kerml/src/examples/Mass Roll-up Example/MassRollup_2.kerml",
      "vendor/corpus/kerml/src/examples/Mass Roll-up Example/Vehicles_1.kerml",
      "vendor/corpus/kerml/src/examples/Mass Roll-up Example/Vehicles_2.kerml",
      "vendor/corpus/kerml/src/examples/Mass Roll-up Example/Vehicles_3.kerml",
      "vendor/corpus/kerml/src/examples/Massed Thing Example/MassedThings.kerml",
      "vendor/corpus/kerml/src/examples/Named Collection Members Example/VehicleTanks.kerml",
      "vendor/corpus/kerml/src/examples/Packet Example/PacketUsage.kerml",
      "vendor/corpus/kerml/src/examples/Packet Example/Packets.kerml",
      "vendor/corpus/kerml/src/examples/Simple Tests/ArgumentResolution.kerml",
      "vendor/corpus/kerml/src/examples/Simple Tests/Associations.kerml",
      "vendor/corpus/kerml/src/examples/Simple Tests/Behaviors.kerml",
      "vendor/corpus/kerml/src/examples/Simple Tests/Circular.kerml",
      "vendor/corpus/kerml/src/examples/Simple Tests/Classes.kerml",
      "vendor/corpus/kerml/src/examples/Simple Tests/Classifications.kerml",
      "vendor/corpus/kerml/src/examples/Simple Tests/Classifiers.kerml",
      "vendor/corpus/kerml/src/examples/Simple Tests/Comments.kerml",
      "vendor/corpus/kerml/src/examples/Simple Tests/Conjugation.kerml",
      "vendor/corpus/kerml/src/examples/Simple Tests/Connectors.kerml",
      "vendor/corpus/kerml/src/examples/Simple Tests/Dependencies.kerml",
      "vendor/corpus/kerml/src/examples/Simple Tests/Expansion.kerml",
      "vendor/corpus/kerml/src/examples/Simple Tests/Expressions.kerml",
      "vendor/corpus/kerml/src/examples/Simple Tests/FeatureChains.kerml",
      "vendor/corpus/kerml/src/examples/Simple Tests/FeatureInheritance.kerml"
    ],
    "metaclass": "SysML::Expression"
  },
  "notes": "no longer declared in the pinned grammar"
}
