{
  "schema_version": 1,
  "production": "EmptySuccession",
  "language": "sysml",
  "status": "retired",
  "fingerprint": {
    "spec_clause": "6e340b9cffb37a989ca544e6bb780a2c78901d3fb33738768511a30617afa01d",
    "xtext_rule": "b993c782178d4421dce0cbb1f9ab77cc757110066d4193dfb02acf99e3871870",
    "corpus_instances": "1eb55586ba6da2475bedd8e39e87c0b2bb15a113483f2e2e74b6ae00f8845fee",
    "combined": "191e6343ac0a4863b5f6ce831a96ae32ab64433fe7ba4cae12c338f21b40e060"
  },
  "inputs": {
    "spec_clause_ref": "",
    "xtext_file": "SysML.xtext",
    "xtext_rule_text": "EmptySuccession returns SysML::SuccessionAsUsage :\n\t'then' ownedRelationship += MultiplicitySourceEndMember \n\townedRelationship += EmptyTargetEndMember\n;",
    "metaclass": "SysML::SuccessionAsUsage"
  },
  "notes": "no longer declared in the pinned grammar"
}
