{
  "schema_version": 1,
  "production": "RequirementBodyItem",
  "language": "sysml",
  "status": "pending",
  "fingerprint": {
    "spec_clause": "5a4c8b221921a02b3db948fbe3524004d517f6417d319714dcfa0af141af350d",
    "xtext_rule": "e06679a642efcb971a1a973189d388275b5494057b74718e456dc435f9a05e85",
    "corpus_instances": "1eb55586ba6da2475bedd8e39e87c0b2bb15a113483f2e2e74b6ae00f8845fee",
    "combined": "669320f1471a16e541e3686793d7853e68a15880de8c3471c4826e6875cb1410"
  },
  "inputs": {
    "spec_clause_ref": "sysml clause 8.2.2.21.1 (RequirementDefinitions.md, region_sha256 fd824f1d9da5f780)",
    "xtext_file": "SysML.xtext",
    "xtext_rule_text": "fragment RequirementBodyItem returns SysML::Type :\n\t  DefinitionBodyItem\n\t| ownedRelationship += SubjectMember\n\t| ownedRelationship += RequirementConstraintMember\n\t| ownedRelationship += FramedConcernMember\n\t| ownedRelationship += RequirementVerificationMember\n\t| ownedRelationship += ActorMember\n\t| ownedRelationship += StakeholderMember\n;",
    "corpus_refs": [
      "vendor/corpus/kerml/src/examples/Address Book Example/AddressBookModel.kerml",
      "vendor/corpus/kerml/src/examples/Association Examples/ProductSelection_N_ary.kerml",
      "vendor/corpus/kerml/src/examples/Association Examples/ProductSelection_OwnedEnds.kerml",
      "vendor/corpus/kerml/src/examples/Association Examples/ProductSelection_UnownedEnds.kerml",
      "vendor/corpus/kerml/src/examples/Behavior Examples/Camera.kerml",
      "vendor/corpus/kerml/src/examples/Behavior Examples/TakePicture.kerml",
      "vendor/corpus/kerml/src/examples/Individuals Examples/JohnIndividualExample.kerml",
      "vendor/corpus/kerml/src/examples/KerML Spec Annex A Examples/A-2-Atoms.kerml",
      "vendor/corpus/kerml/src/examples/KerML Spec Annex A Examples/A-2-ModelingInstances.kerml",
      "vendor/corpus/kerml/src/examples/KerML Spec Annex A Examples/A-3-2-WithoutConnectors.kerml",
      "vendor/corpus/kerml/src/examples/KerML Spec Annex A Examples/A-3-3-OneToOneConnectors.kerml",
      "vendor/corpus/kerml/src/examples/KerML Spec Annex A Examples/A-3-4-OneToUnrestrictedConnectors.kerml",
      "vendor/corpus/kerml/src/examples/KerML Spec Annex A Examples/A-3-5-TimingForStructures.kerml",
      "vendor/corpus/kerml/src/examples/KerML Spec Annex A Examples/A-3-6-Sequences.kerml",
      "vendor/corpus/kerml/src/examples/KerML Spec Annex A Examples/A-3-7-DecisionsAndMerges.kerml",
      "vendor/corpus/kerml/src/examples/KerML Spec Annex A Examples/A-3-8-ChangingFeatureValues.kerml",
      "vendor/corpus/kerml/src/examples/Mass Roll-up Example/MassRollup_1.kerml",
      "vendor/corpus/kerml/src/examples/Mass Roll-up Example/MassRollup_2.kerml",
      "vendor/corpus/kerml/src/examples/Mass Roll-up Example/Vehicles_1.kerml",
      "vendor/corpus/kerml/src/examples/Mass Roll-up Example/Vehicles_2.kerml",
      "vendor/corpus/kerml/src/examples/Mass Roll-up Example/Vehicles_3.kerml",
      "vendor/corpus/kerml/src/examples/Massed Thing Example/MassedThings.kerml",
      "vendor/corpus/kerml/src/examples/Named Collection Members Example/VehicleTanks.kerml",
      "vendor/corpus/kerml/src/examples/Packet Example/PacketUsage.kerml",
      "vendor/corpus/kerml/src/examples/Packet Example/Packets.kerml",
      "vendor/corpus/kerml/src/examples/Simple Tests/ArgumentResolution.kerml",
      "vendor/corpus/kerml/src/examples/Simple Tests/Associations.kerml",
      "vendor/corpus/kerml/src/examples/Simple Tests/Behaviors.kerml",
      "vendor/corpus/kerml/src/examples/Simple Tests/Circular.kerml",
      "vendor/corpus/kerml/src/examples/Simple Tests/Classes.kerml",
      "vendor/corpus/kerml/src/examples/Simple Tests/Classifications.kerml",
      "vendor/corpus/kerml/src/examples/Simple Tests/Classifiers.kerml",
      "vendor/corpus/kerml/src/examples/Simple Tests/Comments.kerml",
      "vendor/corpus/kerml/src/examples/Simple Tests/Conjugation.kerml",
      "vendor/corpus/kerml/src/examples/Simple Tests/Connectors.kerml",
      "vendor/corpus/kerml/src/examples/Simple Tests/Dependencies.kerml",
      "vendor/corpus/kerml/src/examples/Simple Tests/Expansion.kerml",
      "vendor/corpus/kerml/src/examples/Simple Tests/Expressions.kerml",
      "vendor/corpus/kerml/src/examples/Simple Tests/FeatureChains.kerml",
      "vendor/corpus/kerml/src/examples/Simple Tests/FeatureInheritance.kerml"
    ],
    "metaclass": "SysML::Type"
  }
}
