{
  "schema_version": 1,
  "production": "SuccessionFlowUsage",
  "language": "sysml",
  "status": "retired",
  "fingerprint": {
    "spec_clause": "f503f360d20207704de75664ced4bbe1f57e024983fed96db8f3731cd57ee6a9",
    "xtext_rule": "29bfe0d4d33a334190e5b5182bed7ab1227cfc9a20e92a7905bfee4d285ba57e",
    "corpus_instances": "1eb55586ba6da2475bedd8e39e87c0b2bb15a113483f2e2e74b6ae00f8845fee",
    "combined": "8d83332e36118838e3d8016fa85aa2aec3215fdacd5e8b40bd3bbc0b8dbc9a88"
  },
  "inputs": {
    "spec_clause_ref": "sysml clause 8.2.2.16 (FlowsTextualNotation.md, region_sha256 e03f363eef9b4cf1)",
    "xtext_file": "SysML.xtext",
    "xtext_rule_text": "SuccessionFlowUsage returns SysML::SuccessionFlowUsage :\n\tOccurrenceUsagePrefix SuccessionFlowKeyword \n\tFlowDeclaration DefinitionBody\n;",
    "metaclass": "SysML::SuccessionFlowUsage"
  },
  "notes": "re-scoped (ADR-0015): only the sysml grammar reaches this production, so its work now lives in SuccessionFlowUsage@sysml"
}
