{
  "schema_version": 1,
  "production": "FilterPackageNamespaceImport",
  "language": "kerml",
  "status": "retired",
  "fingerprint": {
    "spec_clause": "6e340b9cffb37a989ca544e6bb780a2c78901d3fb33738768511a30617afa01d",
    "xtext_rule": "4498ec8a850d4deaa50066d76c4c3059127c8a811b3d42eeaf007e8d66b05325",
    "corpus_instances": "1eb55586ba6da2475bedd8e39e87c0b2bb15a113483f2e2e74b6ae00f8845fee",
    "combined": "9ad78caeb51dfe8ad3a6523f43a0f16ab5676b39b7c4f1dc9cbded676eb086b6"
  },
  "inputs": {
    "spec_clause_ref": "",
    "xtext_file": "KerML.xtext",
    "xtext_rule_text": "FilterPackageNamespaceImport returns SysML::NamespaceImport :\n\tImportedNamespace\n;",
    "metaclass": "SysML::NamespaceImport"
  },
  "notes": "no longer declared in the pinned grammar"
}
