{
  "schema_version": 1,
  "production": "CrossesKeyword",
  "language": "sysml",
  "status": "retired",
  "fingerprint": {
    "spec_clause": "6e340b9cffb37a989ca544e6bb780a2c78901d3fb33738768511a30617afa01d",
    "xtext_rule": "ede7cd1bf877b1582edc349606f0fcdf12b8a0c8373dea959caca68b4c77e9b6",
    "corpus_instances": "1eb55586ba6da2475bedd8e39e87c0b2bb15a113483f2e2e74b6ae00f8845fee",
    "combined": "e5b5ad51013caf380a0b611baa7cd35a70f2970c1b5baec42346fc83be26e8a1"
  },
  "inputs": {
    "spec_clause_ref": "",
    "xtext_file": "SysML.xtext",
    "xtext_rule_text": "CrossesKeyword :\n\t'=>' | 'crosses'\n;",
    "metaclass": ""
  },
  "notes": "no longer declared in the pinned grammar"
}
