{
  "schema_version": 1,
  "production": "PrefixMetadataAnnotation",
  "language": "kerml",
  "status": "pending",
  "fingerprint": {
    "spec_clause": "a8968e9edcfd0088e52df71a0a82780ff36ef4daf710c41e8e8785feb10cab4a",
    "xtext_rule": "fa4f801563f3c817e0b6ca5f0f49db0ee87e53804a2759105fb7abdb88312847",
    "corpus_instances": "1eb55586ba6da2475bedd8e39e87c0b2bb15a113483f2e2e74b6ae00f8845fee",
    "combined": "acb6e25e7bc5a6ead16586002b5db03cb23b486d7bf4b9d3c4c4d448000d3aed"
  },
  "inputs": {
    "spec_clause_ref": "kerml clause 8.2.5.12 (MetadataConcreteSyntax.md, region_sha256 30fa0599ab27c325) | sysml clause 8.2.2.27 (MetadataTextualNotation.md, region_sha256 69251565feee7639)",
    "xtext_file": "KerML.xtext",
    "xtext_rule_text": "PrefixMetadataAnnotation returns SysML::Annotation :\n\t'#' ownedRelatedElement += PrefixMetadataFeature\n;",
    "corpus_refs": [
      "vendor/corpus/kerml/src/examples/Address Book Example/AddressBookModel.kerml",
      "vendor/corpus/kerml/src/examples/Association Examples/ProductSelection_N_ary.kerml",
      "vendor/corpus/kerml/src/examples/Association Examples/ProductSelection_OwnedEnds.kerml",
      "vendor/corpus/kerml/src/examples/Association Examples/ProductSelection_UnownedEnds.kerml",
      "vendor/corpus/kerml/src/examples/Behavior Examples/Camera.kerml",
      "vendor/corpus/kerml/src/examples/Behavior Examples/TakePicture.kerml",
      "vendor/corpus/kerml/src/examples/Individuals Examples/JohnIndividualExample.kerml",
      "vendor/corpus/kerml/src/examples/KerML Spec Annex A Examples/A-2-Atoms.kerml",
      "vendor/corpus/kerml/src/examples/KerML Spec Annex A Examples/A-2-ModelingInstances.kerml",
      "vendor/corpus/kerml/src/examples/KerML Spec Annex A Examples/A-3-2-WithoutConnectors.kerml",
      "vendor/corpus/kerml/src/examples/KerML Spec Annex A Examples/A-3-3-OneToOneConnectors.kerml",
      "vendor/corpus/kerml/src/examples/KerML Spec Annex A Examples/A-3-4-OneToUnrestrictedConnectors.kerml",
      "vendor/corpus/kerml/src/examples/KerML Spec Annex A Examples/A-3-5-TimingForStructures.kerml",
      "vendor/corpus/kerml/src/examples/KerML Spec Annex A Examples/A-3-6-Sequences.kerml",
      "vendor/corpus/kerml/src/examples/KerML Spec Annex A Examples/A-3-7-DecisionsAndMerges.kerml",
      "vendor/corpus/kerml/src/examples/KerML Spec Annex A Examples/A-3-8-ChangingFeatureValues.kerml",
      "vendor/corpus/kerml/src/examples/Mass Roll-up Example/MassRollup_1.kerml",
      "vendor/corpus/kerml/src/examples/Mass Roll-up Example/MassRollup_2.kerml",
      "vendor/corpus/kerml/src/examples/Mass Roll-up Example/Vehicles_1.kerml",
      "vendor/corpus/kerml/src/examples/Mass Roll-up Example/Vehicles_2.kerml",
      "vendor/corpus/kerml/src/examples/Mass Roll-up Example/Vehicles_3.kerml",
      "vendor/corpus/kerml/src/examples/Massed Thing Example/MassedThings.kerml",
      "vendor/corpus/kerml/src/examples/Named Collection Members Example/VehicleTanks.kerml",
      "vendor/corpus/kerml/src/examples/Packet Example/PacketUsage.kerml",
      "vendor/corpus/kerml/src/examples/Packet Example/Packets.kerml",
      "vendor/corpus/kerml/src/examples/Simple Tests/ArgumentResolution.kerml",
      "vendor/corpus/kerml/src/examples/Simple Tests/Associations.kerml",
      "vendor/corpus/kerml/src/examples/Simple Tests/Behaviors.kerml",
      "vendor/corpus/kerml/src/examples/Simple Tests/Circular.kerml",
      "vendor/corpus/kerml/src/examples/Simple Tests/Classes.kerml",
      "vendor/corpus/kerml/src/examples/Simple Tests/Classifications.kerml",
      "vendor/corpus/kerml/src/examples/Simple Tests/Classifiers.kerml",
      "vendor/corpus/kerml/src/examples/Simple Tests/Comments.kerml",
      "vendor/corpus/kerml/src/examples/Simple Tests/Conjugation.kerml",
      "vendor/corpus/kerml/src/examples/Simple Tests/Connectors.kerml",
      "vendor/corpus/kerml/src/examples/Simple Tests/Dependencies.kerml",
      "vendor/corpus/kerml/src/examples/Simple Tests/Expansion.kerml",
      "vendor/corpus/kerml/src/examples/Simple Tests/Expressions.kerml",
      "vendor/corpus/kerml/src/examples/Simple Tests/FeatureChains.kerml",
      "vendor/corpus/kerml/src/examples/Simple Tests/FeatureInheritance.kerml"
    ],
    "metaclass": "SysML::Annotation"
  }
}
