{
  "schema_version": 1,
  "production": "FeatureDirection",
  "language": "kerml",
  "status": "pending",
  "fingerprint": {
    "spec_clause": "3b1c2f405fca5fb6cb61178744c76e1719ac67174eeeec2d47dd67c0f474fd9d",
    "xtext_rule": "d5e0d17778de8b3b16f6468887e0ba43462baa78381e3851a1c0b2a1c5a157b6",
    "corpus_instances": "1eb55586ba6da2475bedd8e39e87c0b2bb15a113483f2e2e74b6ae00f8845fee",
    "combined": "9a4e606ba5dc7c32473d78c21926ce34f0d3f6a8cc869b041b32c110e37017e3"
  },
  "inputs": {
    "spec_clause_ref": "kerml clause 8.2.4.3.1 (Features.md, region_sha256 c9b4ff39176a7e05) | sysml clause 8.2.2.6.2 (Usages.md, region_sha256 a6f6e20afeed05e4)",
    "xtext_file": "KerML.xtext",
    "xtext_rule_text": "enum FeatureDirection returns SysML::FeatureDirectionKind:\n\tin = 'in' | out = 'out' | inout = 'inout'\n;",
    "metaclass": "SysML::FeatureDirectionKind"
  }
}
