{
  "schema_version": 1,
  "production": "CalculationBody",
  "language": "sysml",
  "status": "pending",
  "fingerprint": {
    "spec_clause": "abc851f79d420fb31d8d7518538400aa03794ce96b1c7f0ed791b9375eeee723",
    "xtext_rule": "ad84fd0f66688bfc10e2d42d496056e6e93f6557dd709b8312acdc933b383efd",
    "corpus_instances": "1eb55586ba6da2475bedd8e39e87c0b2bb15a113483f2e2e74b6ae00f8845fee",
    "combined": "842462ea3e17acb6696e0e5455cd94325b3fc847fc88d85a17c344e79c355e01"
  },
  "inputs": {
    "spec_clause_ref": "sysml clause 8.2.2.19 (CalculationsTextualNotation.md, region_sha256 ee541841395079da)",
    "xtext_file": "SysML.xtext",
    "xtext_rule_text": "fragment CalculationBody returns SysML::Type :\n\t';' | '{' CalculationBodyPart '}' \n;",
    "metaclass": "SysML::Type"
  }
}
