{
  "schema_version": 1,
  "production": "ActionNodePrefix",
  "language": "sysml",
  "status": "retired",
  "fingerprint": {
    "spec_clause": "1d21a99bccb8810f3e974cbe685772d27ca61795e03b0cfdb71408760696f3d8",
    "xtext_rule": "252ff731667ba1802bf473b29a17ca14728551938c27a259ff5863e6867c49f5",
    "corpus_instances": "1eb55586ba6da2475bedd8e39e87c0b2bb15a113483f2e2e74b6ae00f8845fee",
    "combined": "f3205266b42631ade538e15380de66f7699f070878d16db45d0c84e5671bb02b"
  },
  "inputs": {
    "spec_clause_ref": "sysml clause 8.2.2.17.2 (ActionUsages.md, region_sha256 207a908873b90795)",
    "xtext_file": "SysML.xtext",
    "xtext_rule_text": "fragment ActionNodePrefix returns SysML::ActionUsage :\n\tOccurrenceUsagePrefix ActionNodeUsageDeclaration?\n;",
    "metaclass": "SysML::ActionUsage"
  },
  "notes": "re-scoped (ADR-0015): only the sysml grammar reaches this production, so its work now lives in ActionNodePrefix@sysml"
}
