{
  "schema_version": 1,
  "production": "FlowPayloadFeature",
  "language": "shared",
  "status": "retired",
  "fingerprint": {
    "spec_clause": "f503f360d20207704de75664ced4bbe1f57e024983fed96db8f3731cd57ee6a9",
    "xtext_rule": "6e340b9cffb37a989ca544e6bb780a2c78901d3fb33738768511a30617afa01d",
    "corpus_instances": "1eb55586ba6da2475bedd8e39e87c0b2bb15a113483f2e2e74b6ae00f8845fee",
    "combined": "7aabebe3bf9146f03e591395e6391959ab8af208d57cd7108bc1b6a284940805"
  },
  "inputs": {
    "spec_clause_ref": "sysml clause 8.2.2.16 (FlowsTextualNotation.md, region_sha256 e03f363eef9b4cf1)",
    "xtext_file": "",
    "xtext_rule_text": "",
    "metaclass": ""
  },
  "notes": "re-scoped (ADR-0015): only the sysml grammar reaches this production, so its work now lives in FlowPayloadFeature@sysml"
}
