{
  "schema_version": 1,
  "production": "ActionKeyword",
  "language": "sysml",
  "status": "retired",
  "fingerprint": {
    "spec_clause": "6e340b9cffb37a989ca544e6bb780a2c78901d3fb33738768511a30617afa01d",
    "xtext_rule": "eada1b87b7e37558ea4d6b8b015710f06078cab80a1e6ad140c89b2fa40f1454",
    "corpus_instances": "1eb55586ba6da2475bedd8e39e87c0b2bb15a113483f2e2e74b6ae00f8845fee",
    "combined": "33f7547d7251e3dcbee287e8e5b4f7e23ec62a36282ab1f009fe6e4c8c61952a"
  },
  "inputs": {
    "spec_clause_ref": "",
    "xtext_file": "SysML.xtext",
    "xtext_rule_text": "ActionKeyword :\n\t'action'\n;",
    "metaclass": ""
  },
  "notes": "no longer declared in the pinned grammar"
}
