{
  "schema_version": 1,
  "production": "OwnedCrossingFeatureMember",
  "language": "kerml",
  "status": "retired",
  "fingerprint": {
    "spec_clause": "6e340b9cffb37a989ca544e6bb780a2c78901d3fb33738768511a30617afa01d",
    "xtext_rule": "3b8fc690880f011b027cbb3371eb12512dfd7e641e669c7c0aa2707bc6bc48d3",
    "corpus_instances": "1eb55586ba6da2475bedd8e39e87c0b2bb15a113483f2e2e74b6ae00f8845fee",
    "combined": "b25811a8c8264bb7fd801fddf88da0a358d50b55f1df502cb3c28fb8c402bce2"
  },
  "inputs": {
    "spec_clause_ref": "",
    "xtext_file": "KerML.xtext",
    "xtext_rule_text": "OwnedCrossingFeatureMember returns SysML::OwningMembership :\n\townedRelatedElement += OwnedCrossingFeature\n;",
    "metaclass": "SysML::OwningMembership"
  },
  "notes": "no longer declared in the pinned grammar"
}
