{
  "schema_version": 1,
  "production": "SendNodeDeclaration",
  "language": "sysml",
  "status": "retired",
  "fingerprint": {
    "spec_clause": "7a6a999d1ae9a43a228e7f5d4ba57a4c5bb5d3005fb92a5b4f247a0668c5bcd3",
    "xtext_rule": "8120f73bea6c28984e05b919d99215f4da0e7a23e4ef51b856ced3a7856d6030",
    "corpus_instances": "1eb55586ba6da2475bedd8e39e87c0b2bb15a113483f2e2e74b6ae00f8845fee",
    "combined": "3e41e5b7d2426732008ec7fd371a01e9cf40f3bef9a2f833ed6c95d48f438bad"
  },
  "inputs": {
    "spec_clause_ref": "sysml clause 8.2.2.17.4 (SendandAcceptActionUsages.md, region_sha256 ccc8aaaf0c72526e)",
    "xtext_file": "SysML.xtext",
    "xtext_rule_text": "fragment SendNodeDeclaration returns SysML::ActionUsage :\n\tActionNodeUsageDeclaration? 'send' \n\townedRelationship += NodeParameterMember SenderReceiverPart?\n;",
    "metaclass": "SysML::ActionUsage"
  },
  "notes": "re-scoped (ADR-0015): only the sysml grammar reaches this production, so its work now lives in SendNodeDeclaration@sysml"
}
