{
  "schema_version": 1,
  "production": "EmptyTargetEndMember",
  "language": "sysml",
  "status": "retired",
  "fingerprint": {
    "spec_clause": "6e340b9cffb37a989ca544e6bb780a2c78901d3fb33738768511a30617afa01d",
    "xtext_rule": "5153e372c3bf384560b1f722586c9ca5d5182e5eabac8e5d20702ad9c6a27a72",
    "corpus_instances": "1eb55586ba6da2475bedd8e39e87c0b2bb15a113483f2e2e74b6ae00f8845fee",
    "combined": "8296fa7fbf924dce8902cf9f2780c445b6ecd563a65349854ed8b6e87b2ba2b7"
  },
  "inputs": {
    "spec_clause_ref": "",
    "xtext_file": "SysML.xtext",
    "xtext_rule_text": "EmptyTargetEndMember returns SysML::EndFeatureMembership :\n\townedRelatedElement += EmptyTargetEnd \n;",
    "metaclass": "SysML::EndFeatureMembership"
  },
  "notes": "no longer declared in the pinned grammar"
}
