{
  "schema_version": 1,
  "production": "OwnedMultiplicity",
  "language": "kerml",
  "status": "retired",
  "fingerprint": {
    "spec_clause": "f7e4f8282e2e511d221fec61bb0f941cfa1a1dec9a3bf13d7362406bbaf40dbc",
    "xtext_rule": "0fca120ae8205d3a90b00c2ce9c8aba6d6ec120a30259db5fedd4d92e9f1ed91",
    "corpus_instances": "1eb55586ba6da2475bedd8e39e87c0b2bb15a113483f2e2e74b6ae00f8845fee",
    "combined": "f2c109268b0a034120b151bd0f5101fa4308abef6010c34f6ee10b859d485ca0"
  },
  "inputs": {
    "spec_clause_ref": "kerml clause 8.2.5.11 (MultiplicitiesConcreteSyntax.md, region_sha256 01e46f53f28bef82) | sysml clause 8.2.2.6.6 (Multiplicity.md, region_sha256 b1aa1753d059fff8)",
    "xtext_file": "KerML.xtext",
    "xtext_rule_text": "OwnedMultiplicity returns SysML::OwningMembership :\n\townedRelatedElement += OwnedMultiplicityRange \n;",
    "corpus_refs": [
      "vendor/corpus/kerml/src/examples/Address Book Example/AddressBookModel.kerml",
      "vendor/corpus/kerml/src/examples/Association Examples/ProductSelection_N_ary.kerml",
      "vendor/corpus/kerml/src/examples/Association Examples/ProductSelection_OwnedEnds.kerml",
      "vendor/corpus/kerml/src/examples/Association Examples/ProductSelection_UnownedEnds.kerml",
      "vendor/corpus/kerml/src/examples/Behavior Examples/Camera.kerml",
      "vendor/corpus/kerml/src/examples/Behavior Examples/TakePicture.kerml",
      "vendor/corpus/kerml/src/examples/Individuals Examples/JohnIndividualExample.kerml",
      "vendor/corpus/kerml/src/examples/KerML Spec Annex A Examples/A-2-Atoms.kerml",
      "vendor/corpus/kerml/src/examples/KerML Spec Annex A Examples/A-2-ModelingInstances.kerml",
      "vendor/corpus/kerml/src/examples/KerML Spec Annex A Examples/A-3-2-WithoutConnectors.kerml",
      "vendor/corpus/kerml/src/examples/KerML Spec Annex A Examples/A-3-3-OneToOneConnectors.kerml",
      "vendor/corpus/kerml/src/examples/KerML Spec Annex A Examples/A-3-4-OneToUnrestrictedConnectors.kerml",
      "vendor/corpus/kerml/src/examples/KerML Spec Annex A Examples/A-3-5-TimingForStructures.kerml",
      "vendor/corpus/kerml/src/examples/KerML Spec Annex A Examples/A-3-6-Sequences.kerml",
      "vendor/corpus/kerml/src/examples/KerML Spec Annex A Examples/A-3-7-DecisionsAndMerges.kerml",
      "vendor/corpus/kerml/src/examples/KerML Spec Annex A Examples/A-3-8-ChangingFeatureValues.kerml",
      "vendor/corpus/kerml/src/examples/Mass Roll-up Example/MassRollup_1.kerml",
      "vendor/corpus/kerml/src/examples/Mass Roll-up Example/MassRollup_2.kerml",
      "vendor/corpus/kerml/src/examples/Mass Roll-up Example/Vehicles_1.kerml",
      "vendor/corpus/kerml/src/examples/Mass Roll-up Example/Vehicles_2.kerml",
      "vendor/corpus/kerml/src/examples/Mass Roll-up Example/Vehicles_3.kerml",
      "vendor/corpus/kerml/src/examples/Massed Thing Example/MassedThings.kerml",
      "vendor/corpus/kerml/src/examples/Named Collection Members Example/VehicleTanks.kerml",
      "vendor/corpus/kerml/src/examples/Packet Example/PacketUsage.kerml",
      "vendor/corpus/kerml/src/examples/Packet Example/Packets.kerml",
      "vendor/corpus/kerml/src/examples/Simple Tests/ArgumentResolution.kerml",
      "vendor/corpus/kerml/src/examples/Simple Tests/Associations.kerml",
      "vendor/corpus/kerml/src/examples/Simple Tests/Behaviors.kerml",
      "vendor/corpus/kerml/src/examples/Simple Tests/Circular.kerml",
      "vendor/corpus/kerml/src/examples/Simple Tests/Classes.kerml",
      "vendor/corpus/kerml/src/examples/Simple Tests/Classifications.kerml",
      "vendor/corpus/kerml/src/examples/Simple Tests/Classifiers.kerml",
      "vendor/corpus/kerml/src/examples/Simple Tests/Comments.kerml",
      "vendor/corpus/kerml/src/examples/Simple Tests/Conjugation.kerml",
      "vendor/corpus/kerml/src/examples/Simple Tests/Connectors.kerml",
      "vendor/corpus/kerml/src/examples/Simple Tests/Dependencies.kerml",
      "vendor/corpus/kerml/src/examples/Simple Tests/Expansion.kerml",
      "vendor/corpus/kerml/src/examples/Simple Tests/Expressions.kerml",
      "vendor/corpus/kerml/src/examples/Simple Tests/FeatureChains.kerml",
      "vendor/corpus/kerml/src/examples/Simple Tests/FeatureInheritance.kerml"
    ],
    "metaclass": "SysML::OwningMembership"
  },
  "notes": "split per language (ADR-0014): KerML and SysML state this production differently, so it is derived as one variant per language instead"
}
