{
  "schema_version": 1,
  "production": "MetadataUsageKeyword",
  "language": "sysml",
  "status": "retired",
  "fingerprint": {
    "spec_clause": "6e340b9cffb37a989ca544e6bb780a2c78901d3fb33738768511a30617afa01d",
    "xtext_rule": "f81d35513da4a357853143240b24771463a109d71661bbe2684c6fe2c1e5ae1c",
    "corpus_instances": "1eb55586ba6da2475bedd8e39e87c0b2bb15a113483f2e2e74b6ae00f8845fee",
    "combined": "f070496374370582cad7418784ed1671a2631294005a0ae332e3f0cefddfd6c1"
  },
  "inputs": {
    "spec_clause_ref": "",
    "xtext_file": "SysML.xtext",
    "xtext_rule_text": "MetadataUsageKeyword :\n\tMetadataKeyword | '@'\n;",
    "metaclass": ""
  },
  "notes": "no longer declared in the pinned grammar"
}
