{
  "schema_version": 1,
  "production": "PrimaryExpression",
  "language": "kerml",
  "status": "pending",
  "fingerprint": {
    "spec_clause": "a0ac8d0c418826e95262789248a224e62ec9367279a83a5b8c4df179218244a2",
    "xtext_rule": "7624fd7ae79f7ae4e8c2605ceb10bbf30f9286f5233e1411bd8e26e19593653e",
    "corpus_instances": "1eb55586ba6da2475bedd8e39e87c0b2bb15a113483f2e2e74b6ae00f8845fee",
    "combined": "9444001c73f1b1e2c5149e4d20a3b0bd87ecb08c280c2d836600839bec245346"
  },
  "inputs": {
    "spec_clause_ref": "kerml clause 8.2.5.8.2 (PrimaryExpressions.md, region_sha256 9ec248984ce84ebf)",
    "xtext_file": "KerMLExpressions.xtext",
    "xtext_rule_text": "PrimaryExpression returns SysML::Expression :\n\tBaseExpression\n\t( {SysML::FeatureChainExpression.operand += current} '.' \n\t  ownedRelationship += FeatureChainMember\n\t)?\n\t( ( {SysML::IndexExpression.operand += current} \n\t    '#' '(' operand += SequenceExpression ')'\n\t  | {SysML::OperatorExpression.operand += current} \n\t    operator = '[' operand += SequenceExpression ']'\n\t  | {SysML::InvocationExpression.operand += current} '->' \n\t    ownedRelationship += InstantiatedTypeMember \n\t    ( operand += BodyExpression \n\t    | operand += FunctionReferenceExpression \n\t    | ArgumentList\n\t    )\n\t  | {SysML::CollectExpression.operand += current} '.'\n\t    operand += BodyExpression \n\t  | {SysML::SelectExpression.operand += current} '.?'\n\t    operand += BodyExpression \n\t  )\n\t  ( {SysML::FeatureChainExpression.operand += current} '.' \n\t  \townedRelationship += FeatureChainMember\n\t  )?\n\t)*\n;",
    "corpus_refs": [
      "vendor/corpus/kerml/src/examples/Address Book Example/AddressBookModel.kerml",
      "vendor/corpus/kerml/src/examples/Association Examples/ProductSelection_N_ary.kerml",
      "vendor/corpus/kerml/src/examples/Association Examples/ProductSelection_OwnedEnds.kerml",
      "vendor/corpus/kerml/src/examples/Association Examples/ProductSelection_UnownedEnds.kerml",
      "vendor/corpus/kerml/src/examples/Behavior Examples/Camera.kerml",
      "vendor/corpus/kerml/src/examples/Behavior Examples/TakePicture.kerml",
      "vendor/corpus/kerml/src/examples/Individuals Examples/JohnIndividualExample.kerml",
      "vendor/corpus/kerml/src/examples/KerML Spec Annex A Examples/A-2-Atoms.kerml",
      "vendor/corpus/kerml/src/examples/KerML Spec Annex A Examples/A-2-ModelingInstances.kerml",
      "vendor/corpus/kerml/src/examples/KerML Spec Annex A Examples/A-3-2-WithoutConnectors.kerml",
      "vendor/corpus/kerml/src/examples/KerML Spec Annex A Examples/A-3-3-OneToOneConnectors.kerml",
      "vendor/corpus/kerml/src/examples/KerML Spec Annex A Examples/A-3-4-OneToUnrestrictedConnectors.kerml",
      "vendor/corpus/kerml/src/examples/KerML Spec Annex A Examples/A-3-5-TimingForStructures.kerml",
      "vendor/corpus/kerml/src/examples/KerML Spec Annex A Examples/A-3-6-Sequences.kerml",
      "vendor/corpus/kerml/src/examples/KerML Spec Annex A Examples/A-3-7-DecisionsAndMerges.kerml",
      "vendor/corpus/kerml/src/examples/KerML Spec Annex A Examples/A-3-8-ChangingFeatureValues.kerml",
      "vendor/corpus/kerml/src/examples/Mass Roll-up Example/MassRollup_1.kerml",
      "vendor/corpus/kerml/src/examples/Mass Roll-up Example/MassRollup_2.kerml",
      "vendor/corpus/kerml/src/examples/Mass Roll-up Example/Vehicles_1.kerml",
      "vendor/corpus/kerml/src/examples/Mass Roll-up Example/Vehicles_2.kerml",
      "vendor/corpus/kerml/src/examples/Mass Roll-up Example/Vehicles_3.kerml",
      "vendor/corpus/kerml/src/examples/Massed Thing Example/MassedThings.kerml",
      "vendor/corpus/kerml/src/examples/Named Collection Members Example/VehicleTanks.kerml",
      "vendor/corpus/kerml/src/examples/Packet Example/PacketUsage.kerml",
      "vendor/corpus/kerml/src/examples/Packet Example/Packets.kerml",
      "vendor/corpus/kerml/src/examples/Simple Tests/ArgumentResolution.kerml",
      "vendor/corpus/kerml/src/examples/Simple Tests/Associations.kerml",
      "vendor/corpus/kerml/src/examples/Simple Tests/Behaviors.kerml",
      "vendor/corpus/kerml/src/examples/Simple Tests/Circular.kerml",
      "vendor/corpus/kerml/src/examples/Simple Tests/Classes.kerml",
      "vendor/corpus/kerml/src/examples/Simple Tests/Classifications.kerml",
      "vendor/corpus/kerml/src/examples/Simple Tests/Classifiers.kerml",
      "vendor/corpus/kerml/src/examples/Simple Tests/Comments.kerml",
      "vendor/corpus/kerml/src/examples/Simple Tests/Conjugation.kerml",
      "vendor/corpus/kerml/src/examples/Simple Tests/Connectors.kerml",
      "vendor/corpus/kerml/src/examples/Simple Tests/Dependencies.kerml",
      "vendor/corpus/kerml/src/examples/Simple Tests/Expansion.kerml",
      "vendor/corpus/kerml/src/examples/Simple Tests/Expressions.kerml",
      "vendor/corpus/kerml/src/examples/Simple Tests/FeatureChains.kerml",
      "vendor/corpus/kerml/src/examples/Simple Tests/FeatureInheritance.kerml"
    ],
    "metaclass": "SysML::Expression"
  }
}
